{
  "$schema": "http://json-schema.org/draft-07/schema#",
  "title": "Weekly Meals dish manifest",
  "type": "object",
  "required": ["version", "categories", "proteinCategories", "dishes"],
  "properties": {
    "$schema": { "type": "string" },
    "version": { "type": "integer" },
    "categories": {
      "type": "object",
      "required": ["lunch", "dinner"],
      "additionalProperties": { "type": "array", "items": { "type": "string" } }
    },
    "proteinCategories": { "type": "array", "items": { "type": "string" } },
    "dishes": {
      "type": "array",
      "items": {
        "type": "object",
        "required": ["id", "name", "meals", "category", "prep", "icon"],
        "properties": {
          "id":       { "type": "string", "pattern": "^[a-z0-9-]+$" },
          "name":     { "type": "string", "minLength": 1 },
          "meals":    { "type": "array", "minItems": 1,
                        "items": { "enum": ["lunch", "dinner"] } },
          "category": { "type": "string" },
          "prep":     { "type": "string", "minLength": 1 },
          "icon":     { "type": "string", "pattern": "^[a-z0-9_-]+$" },
          "description": { "type": "string" }
        },
        "additionalProperties": false
      }
    }
  }
}
